Name	Email	Phone	Description
"Terrell Shanahan"	wiegand.madelynn@koss.com	1-646-446-9916	"Harum provident sit explicabo. Voluptate voluptatum quibusdam modi nihil recusandae quibusdam. Hic ducimus ipsum officia aspernatur quasi."
"Shayna Balistreri I"	nola47@hickle.com	+1-440-817-6729	"Omnis qui eius repellendus explicabo magni explicabo. Et non et voluptas pariatur sit ullam totam. Quae architecto aliquam voluptatem rerum corrupti itaque. A corporis vero ut et odit dolores."
"Kristina Hettinger DDS"	everette47@hotmail.com	1-854-824-7505	"Autem veritatis excepturi temporibus architecto numquam repellendus. Architecto molestiae neque assumenda recusandae. Voluptatem maxime et libero et quia et. Laboriosam et aut nostrum."
"Mary Weber"	dickens.cordie@howe.com	1-218-294-0247	"Placeat quibusdam autem magnam quo ut. Quas ut voluptates cumque sit laudantium earum magni. Error officia est ratione dolores ipsum ipsa."
"Norval Emard"	schuppe.lina@willms.net	1-629-867-0952	"Numquam qui sit consectetur animi. Itaque id qui aut cupiditate."
"Nasir Ritchie"	valerie18@rosenbaum.com	747-968-4466	"Est nulla accusamus rem quidem. Optio odio enim eum ducimus. Explicabo qui unde sit sint quia iusto. Dolorem illum perferendis ea velit reiciendis."
"Willa Hegmann"	hgreen@yahoo.com	585.550.8877	"Sed et distinctio laboriosam consequatur. Sint eaque libero cum facere suscipit deleniti."
"Dr. Dalton Lynch"	ogottlieb@gmail.com	+1-743-261-8076	"Assumenda explicabo iste doloribus. Quis quos aut molestiae ut dolorum mollitia incidunt. Voluptas rem sunt est et illum labore. Voluptatem id sit autem fugiat aut minus perferendis."
"Prof. Dayna Maggio"	eloy99@ernser.com	+1-915-620-0679	"Veniam minima recusandae neque quas rerum temporibus ipsum. Architecto dignissimos aliquid velit porro saepe. Maiores distinctio ducimus nam occaecati quibusdam laborum."
"Anderson Upton"	candido.torphy@gmail.com	910-353-6323	"Est ut esse consequuntur dicta rerum laborum velit vitae. Rem quas sint non architecto. Quis beatae assumenda saepe nisi necessitatibus et tenetur. Ea a in enim fugiat consequatur soluta."
